-- Copyright (c) 2017-2023 VMware, Inc. or its affiliates
-- SPDX-License-Identifier: Apache-2.0

-- Test to ensure that AOCO tables with multiple segfiles can be upgraded
-- successfully. Multiple sessions are utilized to create multiple segfiles.

--------------------------------------------------------------------------------
-- Create and setup upgradeable objects
--------------------------------------------------------------------------------

-- AOCO table with multiple segment files
CREATE TABLE aoco_multi_segment (id integer, name text) WITH (appendonly=true, orientation=column) DISTRIBUTED BY (id);
CREATE

1:BEGIN;
BEGIN
2:BEGIN;
BEGIN
1:INSERT INTO aoco_multi_segment VALUES (1, 'Jane');
INSERT 1
1:INSERT INTO aoco_multi_segment VALUES (2, 'John');
INSERT 1
2:INSERT INTO aoco_multi_segment VALUES (3, 'Joe');
INSERT 1
1:END;
END
2:END;
END

SELECT * FROM aoco_multi_segment ORDER BY id;
 id | name 
----+------
 1  | Jane 
 2  | John 
 3  | Joe  
(3 rows)
SELECT segno, column_num, physical_segno, tupcount, eof, eof_uncompressed, modcount, formatversion, state FROM gp_toolkit.__gp_aocsseg_name('aoco_multi_segment') ORDER BY 1, 2;
 segno | column_num | physical_segno | tupcount | eof | eof_uncompressed | modcount | formatversion | state 
-------+------------+----------------+----------+-----+------------------+----------+---------------+-------
 1     | 0          | 1              | 2        | 0   | 0                | 2        | 3             | 1     
 1     | 1          | 129            | 2        | 0   | 0                | 2        | 3             | 1     
 2     | 0          | 2              | 1        | 0   | 0                | 1        | 3             | 1     
 2     | 1          | 130            | 1        | 0   | 0                | 1        | 3             | 1     
(4 rows)
SELECT gp_segment_id, (t).segno, (t).column_num, (t).physical_segno, (t).tupcount, (t).eof, (t).eof_uncompressed, (t).modcount, (t).formatversion, (t).state FROM (SELECT gp_segment_id, gp_toolkit.__gp_aocsseg_name('aoco_multi_segment') AS t FROM gp_dist_random('gp_id')) AS x ORDER BY 1, 2, 3;
 gp_segment_id | segno | column_num | physical_segno | tupcount | eof | eof_uncompressed | modcount | formatversion | state 
---------------+-------+------------+----------------+----------+-----+------------------+----------+---------------+-------
 0             | 1     | 0          | 1              | 2        | 96  | 96               | 2        | 3             | 1     
 0             | 1     | 1          | 129            | 2        | 96  | 96               | 2        | 3             | 1     
 1             | 2     | 0          | 2              | 1        | 48  | 48               | 1        | 3             | 1     
 1             | 2     | 1          | 130            | 1        | 48  | 48               | 1        | 3             | 1     
(4 rows)



-- AOCO table with deleted rows that meets compaction threshold
CREATE TABLE aoco_vacuum_compact_after_upgrade (a int, b int) WITH (appendonly=true, orientation=column);
CREATE

1: BEGIN;
BEGIN
1: INSERT INTO aoco_vacuum_compact_after_upgrade SELECT i, i FROM generate_series(1,10)i;
INSERT 10
2: INSERT INTO aoco_vacuum_compact_after_upgrade SELECT i, i FROM generate_series(11,20)i;
INSERT 10
1: COMMIT;
COMMIT
DELETE FROM aoco_vacuum_compact_after_upgrade WHERE a > 5;
DELETE 15

SELECT * FROM aoco_vacuum_compact_after_upgrade ORDER BY a;
 a | b 
---+---
 1 | 1 
 2 | 2 
 3 | 3 
 4 | 4 
 5 | 5 
(5 rows)
SELECT segno, column_num, physical_segno, tupcount, eof, eof_uncompressed, modcount, formatversion, state FROM gp_toolkit.__gp_aocsseg_name('aoco_vacuum_compact_after_upgrade') ORDER BY 1, 2;
 segno | column_num | physical_segno | tupcount | eof | eof_uncompressed | modcount | formatversion | state 
-------+------------+----------------+----------+-----+------------------+----------+---------------+-------
 1     | 0          | 1              | 10       | 0   | 0                | 2        | 3             | 1     
 1     | 1          | 129            | 10       | 0   | 0                | 2        | 3             | 1     
 2     | 0          | 2              | 10       | 0   | 0                | 1        | 3             | 1     
 2     | 1          | 130            | 10       | 0   | 0                | 1        | 3             | 1     
(4 rows)
SELECT gp_segment_id, (t).segno, (t).column_num, (t).physical_segno, (t).tupcount, (t).eof, (t).eof_uncompressed, (t).modcount, (t).formatversion, (t).state FROM (SELECT gp_segment_id, gp_toolkit.__gp_aocsseg_name('aoco_vacuum_compact_after_upgrade') AS t FROM gp_dist_random('gp_id')) AS x ORDER BY 1, 2, 3;
 gp_segment_id | segno | column_num | physical_segno | tupcount | eof | eof_uncompressed | modcount | formatversion | state 
---------------+-------+------------+----------------+----------+-----+------------------+----------+---------------+-------
 0             | 1     | 0          | 1              | 2        | 48  | 48               | 1        | 3             | 1     
 0             | 1     | 1          | 129            | 2        | 48  | 48               | 1        | 3             | 1     
 0             | 2     | 0          | 2              | 5        | 64  | 64               | 1        | 3             | 1     
 0             | 2     | 1          | 130            | 5        | 64  | 64               | 1        | 3             | 1     
 1             | 1     | 0          | 1              | 5        | 64  | 64               | 1        | 3             | 1     
 1             | 1     | 1          | 129            | 5        | 64  | 64               | 1        | 3             | 1     
 1             | 2     | 0          | 2              | 3        | 56  | 56               | 1        | 3             | 1     
 1             | 2     | 1          | 130            | 3        | 56  | 56               | 1        | 3             | 1     
 2             | 1     | 0          | 1              | 3        | 56  | 56               | 1        | 3             | 1     
 2             | 1     | 1          | 129            | 3        | 56  | 56               | 1        | 3             | 1     
 2             | 2     | 0          | 2              | 2        | 48  | 48               | 1        | 3             | 1     
 2             | 2     | 1          | 130            | 2        | 48  | 48               | 1        | 3             | 1     
(12 rows)



-- AOCO table with an AO segment in awaiting drop state
CREATE TABLE aoco_with_awaiting_drop_state_before_upgrade (a int, b int) WITH (appendonly=true, orientation=column);
CREATE
INSERT INTO aoco_with_awaiting_drop_state_before_upgrade SELECT i, i FROM generate_series(1,10)i;
INSERT 10
DELETE FROM aoco_with_awaiting_drop_state_before_upgrade;
DELETE 10

1: BEGIN;
BEGIN
1: SELECT * FROM aoco_with_awaiting_drop_state_before_upgrade ORDER BY a;
 a | b 
---+---
(0 rows)
2: VACUUM aoco_with_awaiting_drop_state_before_upgrade;
VACUUM
1: END;
END

SELECT * FROM aoco_with_awaiting_drop_state_before_upgrade ORDER BY a;
 a | b 
---+---
(0 rows)
SELECT segno, column_num, physical_segno, tupcount, eof, eof_uncompressed, modcount, formatversion, state FROM gp_toolkit.__gp_aocsseg_name('aoco_with_awaiting_drop_state_before_upgrade') ORDER BY 1, 2;
 segno | column_num | physical_segno | tupcount | eof | eof_uncompressed | modcount | formatversion | state 
-------+------------+----------------+----------+-----+------------------+----------+---------------+-------
 1     | 0          | 1              | 10       | 0   | 0                | 2        | 3             | 1     
 1     | 1          | 129            | 10       | 0   | 0                | 2        | 3             | 1     
(2 rows)
SELECT gp_segment_id, (t).segno, (t).column_num, (t).physical_segno, (t).tupcount, (t).eof, (t).eof_uncompressed, (t).modcount, (t).formatversion, (t).state FROM (SELECT gp_segment_id, gp_toolkit.__gp_aocsseg_name('aoco_with_awaiting_drop_state_before_upgrade') AS t FROM gp_dist_random('gp_id')) AS x ORDER BY 1, 2, 3;
 gp_segment_id | segno | column_num | physical_segno | tupcount | eof | eof_uncompressed | modcount | formatversion | state 
---------------+-------+------------+----------------+----------+-----+------------------+----------+---------------+-------
 0             | 1     | 0          | 1              | 2        | 48  | 48               | 1        | 3             | 2     
 0             | 1     | 1          | 129            | 2        | 48  | 48               | 1        | 3             | 2     
 0             | 2     | 0          | 2              | 0        | 0   | 0                | 1        | 3             | 1     
 0             | 2     | 1          | 130            | 0        | 0   | 0                | 1        | 3             | 1     
 1             | 1     | 0          | 1              | 5        | 64  | 64               | 1        | 3             | 2     
 1             | 1     | 1          | 129            | 5        | 64  | 64               | 1        | 3             | 2     
 1             | 2     | 0          | 2              | 0        | 0   | 0                | 1        | 3             | 1     
 1             | 2     | 1          | 130            | 0        | 0   | 0                | 1        | 3             | 1     
 2             | 1     | 0          | 1              | 3        | 56  | 56               | 1        | 3             | 2     
 2             | 1     | 1          | 129            | 3        | 56  | 56               | 1        | 3             | 2     
 2             | 2     | 0          | 2              | 0        | 0   | 0                | 1        | 3             | 1     
 2             | 2     | 1          | 130            | 0        | 0   | 0                | 1        | 3             | 1     
(12 rows)

INSERT INTO aoco_with_awaiting_drop_state_before_upgrade SELECT i, i FROM generate_series(1,10)i;
INSERT 10

SELECT * FROM aoco_with_awaiting_drop_state_before_upgrade ORDER BY a;
 a  | b  
----+----
 1  | 1  
 2  | 2  
 3  | 3  
 4  | 4  
 5  | 5  
 6  | 6  
 7  | 7  
 8  | 8  
 9  | 9  
 10 | 10 
(10 rows)
SELECT segno, column_num, physical_segno, tupcount, eof, eof_uncompressed, modcount, formatversion, state FROM gp_toolkit.__gp_aocsseg_name('aoco_with_awaiting_drop_state_before_upgrade') ORDER BY 1, 2;
 segno | column_num | physical_segno | tupcount | eof | eof_uncompressed | modcount | formatversion | state 
-------+------------+----------------+----------+-----+------------------+----------+---------------+-------
 1     | 0          | 1              | 10       | 0   | 0                | 2        | 3             | 1     
 1     | 1          | 129            | 10       | 0   | 0                | 2        | 3             | 1     
 2     | 0          | 2              | 10       | 0   | 0                | 1        | 3             | 1     
 2     | 1          | 130            | 10       | 0   | 0                | 1        | 3             | 1     
(4 rows)
SELECT gp_segment_id, (t).segno, (t).column_num, (t).physical_segno, (t).tupcount, (t).eof, (t).eof_uncompressed, (t).modcount, (t).formatversion, (t).state FROM (SELECT gp_segment_id, gp_toolkit.__gp_aocsseg_name('aoco_with_awaiting_drop_state_before_upgrade') AS t FROM gp_dist_random('gp_id')) AS x ORDER BY 1, 2, 3;
 gp_segment_id | segno | column_num | physical_segno | tupcount | eof | eof_uncompressed | modcount | formatversion | state 
---------------+-------+------------+----------------+----------+-----+------------------+----------+---------------+-------
 0             | 1     | 0          | 1              | 2        | 48  | 48               | 1        | 3             | 2     
 0             | 1     | 1          | 129            | 2        | 48  | 48               | 1        | 3             | 2     
 0             | 2     | 0          | 2              | 2        | 48  | 48               | 2        | 3             | 1     
 0             | 2     | 1          | 130            | 2        | 48  | 48               | 2        | 3             | 1     
 1             | 1     | 0          | 1              | 5        | 64  | 64               | 1        | 3             | 2     
 1             | 1     | 1          | 129            | 5        | 64  | 64               | 1        | 3             | 2     
 1             | 2     | 0          | 2              | 5        | 64  | 64               | 2        | 3             | 1     
 1             | 2     | 1          | 130            | 5        | 64  | 64               | 2        | 3             | 1     
 2             | 1     | 0          | 1              | 3        | 56  | 56               | 1        | 3             | 2     
 2             | 1     | 1          | 129            | 3        | 56  | 56               | 1        | 3             | 2     
 2             | 2     | 0          | 2              | 3        | 56  | 56               | 2        | 3             | 1     
 2             | 2     | 1          | 130            | 3        | 56  | 56               | 2        | 3             | 1     
(12 rows)



-- AOCO table with empty AO segments
CREATE TABLE aoco_with_empty_aosegs_before_upgrade (a int) WITH (appendonly=true, orientation=column);
CREATE

1: BEGIN;
BEGIN
2: BEGIN;
BEGIN
1: INSERT INTO aoco_with_empty_aosegs_before_upgrade SELECT generate_series(1,10);
INSERT 10
2: INSERT INTO aoco_with_empty_aosegs_before_upgrade SELECT generate_series(1,10);
INSERT 10
3: INSERT INTO aoco_with_empty_aosegs_before_upgrade SELECT generate_series(11,20);
INSERT 10
1: COMMIT;
COMMIT
2: COMMIT;
COMMIT
DELETE FROM aoco_with_empty_aosegs_before_upgrade;
DELETE 30
VACUUM aoco_with_empty_aosegs_before_upgrade;
VACUUM

SELECT * FROM aoco_with_empty_aosegs_before_upgrade ORDER BY a;
 a 
---
(0 rows)
SELECT segno, column_num, physical_segno, tupcount, eof, eof_uncompressed, modcount, formatversion, state FROM gp_toolkit.__gp_aocsseg_name('aoco_with_empty_aosegs_before_upgrade') ORDER BY 1, 2;
 segno | column_num | physical_segno | tupcount | eof | eof_uncompressed | modcount | formatversion | state 
-------+------------+----------------+----------+-----+------------------+----------+---------------+-------
 1     | 0          | 1              | 0        | 0   | 0                | 2        | 3             | 1     
 2     | 0          | 2              | 0        | 0   | 0                | 1        | 3             | 1     
 3     | 0          | 3              | 0        | 0   | 0                | 1        | 3             | 1     
(3 rows)
SELECT gp_segment_id, (t).segno, (t).column_num, (t).physical_segno, (t).tupcount, (t).eof, (t).eof_uncompressed, (t).modcount, (t).formatversion, (t).state FROM (SELECT gp_segment_id, gp_toolkit.__gp_aocsseg_name('aoco_with_empty_aosegs_before_upgrade') AS t FROM gp_dist_random('gp_id')) AS x ORDER BY 1, 2, 3;
 gp_segment_id | segno | column_num | physical_segno | tupcount | eof | eof_uncompressed | modcount | formatversion | state 
---------------+-------+------------+----------------+----------+-----+------------------+----------+---------------+-------
 0             | 1     | 0          | 1              | 0        | 0   | 0                | 1        | 3             | 1     
 0             | 2     | 0          | 2              | 0        | 0   | 0                | 1        | 3             | 1     
 0             | 3     | 0          | 3              | 0        | 0   | 0                | 1        | 3             | 1     
 0             | 4     | 0          | 4              | 0        | 0   | 0                | 3        | 3             | 1     
 1             | 1     | 0          | 1              | 0        | 0   | 0                | 1        | 3             | 1     
 1             | 2     | 0          | 2              | 0        | 0   | 0                | 1        | 3             | 1     
 1             | 3     | 0          | 3              | 0        | 0   | 0                | 1        | 3             | 1     
 1             | 4     | 0          | 4              | 0        | 0   | 0                | 3        | 3             | 1     
 2             | 1     | 0          | 1              | 0        | 0   | 0                | 1        | 3             | 1     
 2             | 2     | 0          | 2              | 0        | 0   | 0                | 1        | 3             | 1     
 2             | 3     | 0          | 3              | 0        | 0   | 0                | 1        | 3             | 1     
 2             | 4     | 0          | 4              | 0        | 0   | 0                | 3        | 3             | 1     
(12 rows)
